{
  "proto_version": "1.0",
  "trace_id": "a1b2c3d4-e5f6-7890-abcd-ef1234567890",
  "msg_id": "00000000-0000-0000-0000-000000000002",
  "msg_type": "response",
  "timestamp": 1715000001,
  "source": "worker",
  "source_id": "worker-1",
  "target": "master",
  "correlation_id": "00000000-0000-0000-0000-000000000001",
  "priority": 0,
  "payload": {
    "action": "ping.icmp",
    "status": "success",
    "data": { "alive": true }
  }
}
