{
  "proto_version": "1.0",
  "trace_id": "a1b2c3d4-e5f6-7890-abcd-ef1234567890",
  "msg_id": "00000000-0000-0000-0000-000000000003",
  "msg_type": "heartbeat",
  "timestamp": 1715000030,
  "source": "worker",
  "source_id": "worker-1",
  "target": "master",
  "payload": {
    "action": "ping.icmp",
    "status": "pending"
  }
}
